{
  "nodes": [
    {
      "arch_id": "arch-node:project:aaaaaaaaaaaaaaaaaaaaaaaaaaaaaaaa:bbbbbbbbbbbbbbbbbbbbbbbbbbbbbbbb",
      "binding_ids": [
        "repository-binding:dddddddddddddddddddddddddddddddd",
        "repository-binding:eeeeeeeeeeeeeeeeeeeeeeeeeeeeeeee"
      ],
      "confidence": "high",
      "last_projected_at": "2026-07-20T00:00:00Z",
      "merged_from": [],
      "note_path": "Components/auth-service.md",
      "per_binding_coverage": [
        {
          "binding_id": "repository-binding:dddddddddddddddddddddddddddddddd",
          "coverage": "observed",
          "fact_class": "symbols"
        }
      ],
      "per_binding_status": [
        {
          "binding_id": "repository-binding:dddddddddddddddddddddddddddddddd",
          "status": "available"
        },
        {
          "binding_id": "repository-binding:eeeeeeeeeeeeeeeeeeeeeeeeeeeeeeee",
          "status": "unavailable"
        }
      ],
      "prior_names": [],
      "project_id": "project:aaaaaaaaaaaaaaaaaaaaaaaaaaaaaaaa",
      "projection_schema_version": 1,
      "projection_status": "partial",
      "projection_type": "arch_component",
      "provider_name": "reference",
      "provider_version": "1.0.0",
      "source_commits": [
        {
          "binding_id": "repository-binding:dddddddddddddddddddddddddddddddd",
          "commit": "eeeeeeeeeeeeeeeeeeeeeeeeeeeeeeeeeeeeeeee"
        }
      ],
      "source_paths": [
        "bin/architecture/state.py"
      ],
      "source_symbols": [],
      "split_into": [],
      "superseded_by": []
    }
  ],
  "project_id": "project:aaaaaaaaaaaaaaaaaaaaaaaaaaaaaaaa",
  "projection_schema_version": 1,
  "references": [],
  "schema_version": 1
}
